,Hinglish_Comments
1983,Ye sarkar jo bhi bolti hai sab jhoot nikalte hayeen sadakkonko banado jhoothi Sarkar baharath ko barbaad math Karo behetar rah…See more
1984,Mogli hai toh pumkin hein.Vote chor gadi chhor
1985,Andhbhakt nhi manenge
1986,BJP logo ko chotia banrhe hai vote chor BJP sarkar BJP hatao pure desh bachao ji hindi
1987,Hath mein uthakar dikha rahe the daba andar karne ke bad kolli karke dikha Dena Mamta
1988,Bjp log kya kya karta hai
1989,Sarkar galat nahin Hai hamare Desh ke andhbhakt log galat ho gaye
1990,Notanki hai
1991,Modi kitton ko chutiya banaa Raha and bhakton Ko andhbhakt Hai sale vaise Hi Rahenge gomutra gobar
1992,Bjp ki jai ho
1993,Dekh lo andhbhakto
1994,Bhai woh ghobar khane wala log?
1995,11 saal aap ne jo naas pita h wo 7 mahine me kaise kam hoga
1996,Godi Media gala far far ke chilla ta tha vo kaha gazajb hogaya.
1997,Aap wale aap itna .B..nahi banaya murkh khujali wal
1998,Modi ha to mumkin hai
1999,Aap adani chor kutta salay chut Bol raha hai janta Dilli say Bagaya hai
2000,Modi ko vot nihi dena hai
2001,Modi hai to mumkin hai bhai sab jhut hai bahut jhuti hai  BJP
2002,Modi chatpuja badnam mat kar sudar jaa dish bichani ki atyare kar raha hi
2003,Tumhare shasan mein to yah bhi nahin hua tha
2004,Itna sach mat dikha bhai
2005,Are fisal Gaya yeh tune kya Kiya
2006,Mubarak ho Delhi supporters
2007,Chor hai sab
2008,Yeah hindu keliya katra hai hindu daram ka naam me modi natak karta hai  pura india ka hindu ko bakuf banata hai modi ji
2009,Sala ham chutiya he
2010,Yamuna saf kardiya Bjp ne ..jhuti khabor mat felawo .. dall galne wala nehi hay
2011,Feku ji hai toh Mumkin hai
2012,Bjp RSS wale chutiya hai
2013,Bjp desh k liye ek esa jahar ban chuki hai jiska khamiyaja aap ki ani wali pidi ko bhi bhi jhelna padega...ab no jumla no bjp.…See more
2014,Neta ji to Nikal liye ab kon lega Ganga ki jimedari
2015,Jo log gomutra Pi sakte hain vah Nadi nalaak aur gatar ka Pani bhi Pi sakte hain
2016,Kam se kam kar toh rehi hai..pehele toh esab v nehi hota tha
2017,Sahi kar rahi hai bjpDl balo ke shath inhe to bas musalman ko dukh hona chahiye
2018,Yah sare neta insanon per kichad uchhalte hain aur bol bol te hain ki Ham Vikas kar rahe hain isiliye dukaane thodi ja rahi ha…See more
2019,Isme Modi ki galti nahi jab janta hu chutiya hai to wo kya kare
2020,जो किया जा रहा है छठ व्रती के हित में है। MC अगर तुम्हारे गान फट रहा है तो उसे ढंक कर रखो नहीं तो कहीं ऐसा न हो कि तुमलोगों क…See more
2021,Modi hai to mumkin hai
2022,Kitna girega ye dobi
2023,Sir Monitoring station hata do .yeah karne ka bhi jarurat nhi padega..aisehi tax ka paisa kyu barbad karna hain
2024,Bhakt nhi manenge
2025,Yah BJP government hamesha Bhakt ko chutiya banata hai ab bhakt to ban  jata hai kab samjhega BJP ka chaal dont trust
2026,aap ने तो कुछ भी नहीं किया था इन्होंने कुछ तो किया हाई
2027,BJP walon ka kam hai logon Ko gomutra pilana nali ka Pani pilana Nadi ka Pani pilana
2028,Khud gira he vo video bhi Lavo Zara
2029,Vote chor puja mein bhi chori
2030,Sorav bhai ye paani nahi piraha ye to go mutr piraha he
2031,Yah Jhuthe Ki Sarkar Hai fenkuon Ki fenku Hai Sab ismein
2032,Bjp ke or modi ke maa k bhosda
2033,"Without a PIN, you could lose your chat history when you clear your cache, change browsers or devices, or log out."
2034,School ki chutti karo dispencery time bhi change karo zyada work from home or koyla ban karo
2035,I love my Kejriwal Kejriwal BJP Nahin de sakti
2036,Ab Koi and bhugtan ke ke yah pollution Kyon Ho Raha Hai Kejriwal ke time mein to Sabke dete
2037,Work from home kar dena chahiejab tak pollution jyada hai aur aane jaane se logon ka kam kar dena chahie
2038,Bachchon ko chutti nahi mil raha school se jo young Hain unke liye work from home
2039,Mere v baby ko bahut hi
2040,Bam ko fodhne ko kyu kha
2041,School kyun nhi bandh horahe?
2042,Bhai yeh Delhi sarkar hai abhi to aage dekho
2043,Sadak par bhatti or chulhe  tandoor band karo
2044,School 12 th tak band hone chahiye
2045,Re ki man chut Jayegi Kejriwal ki jagah Rah Nahin sakti hai
2046,Rekha Gupta ko Delhi band Kar deni chahiye
2047,Koi pollution nhi hai bakwas hai paisa kamane ka dhandha bna rkha hai
2048,Sarkaar 60'/.Janta 40'/. Khud Dosi Bajah Delhi Ka Gaddi 40'/. Bahar Ka 60'/. Janta Bhi Delhi Ka 40'/. Bahar Ka 60'/. Gaddi Hai…See more
2049,Sarkari job ki Fer mauj....unko ghar bedhe hi salary de doo ab toh pvt log ko 24 hrs kaam karna padegha ab se...wah
2050,Pardushan to hoga jab diwali pr itne patake jalate ho
2051,aor bezubaan baccho per atyachar karo kaha hai. Cm rakha gupta
2052,"Without a PIN, you could lose your chat history when you clear your cache, change browsers or devices, or log out."
2053,Ye to BJP ko full majority se bhi upar ho gya
2054,Koi bat nhi abhi chunav nhi hai wahan
2055,Kejriwal ji h na harr ka badla lene k lie  punjab s jada s jada parali jal wah rahe h delhi ko pollution bada rahe h
2056,Rekha Gupta ko photo khichwane se time Miley Toh Kuch kaam Karey naa.. too toxic Air Delhi..
2057,Wah abki baar 600 paar jioo modi ji
2058,Ye vichar karne yog samasaya nahi hai. Dogs and cows are real threat to environment.
2059,Sab pataka fodo hawa saaf hojayega or new year me pura hawa saaf ho jayega delhi walo
2060,Ab school kyu nhe band kar rahe
2061,Bhai ek bar aur Diwali mana lete haiYe puchna tha bhadwe parchi wale se
2062,Kejriwal ki galati hai usne achha kaam nahi kiya Isme BJP wale kya kare
2063,Itni subdh hawa ko ye log aise dikha the hai khair sab acha hai
2064,BJP sarkar ne delhi me mouj kara rakhi hai
2065,Ab delhi mai election nahi hai sab theek hai anekh band karo
2066,School bnd karo bacho ki bhi socho
2067,Ajj hai sukarwaarAbb kiya kreDeli skrr
2068,Ab to pathakhe nahi chal rahe fir bhi
2069,Har Har Modi bolo aur maze karo
2070,Punjab se aa rha hai
2071,Modi Hai To Mumkin haiYahi the tumhare acche din
2072,Aur fodo patakhe
2073,Sarkar badalne ka kya fayda hua ??
2074,Aaj to Friday hai.
2075,Ab lelo Maje
2076,Very goodbahut badiya hora hai
2077,Jai ho bjp ki
2078,Kejru Zihad hai
2079,Jai ho bjp walo
2080,Ab toh bjp ha mar ja a gey per bolegey nhe ager kajwal hota jab boltey
2081,Jasan batao modi fir se a gay
2082,Bhai kejriwal ne jo panjab chula jala rkka hai bhi aa rha PULOSTION
2083,Delhi wale fir bhi nhi jaag rhe
2084,"Without a PIN, you could lose your chat history when you clear your cache, change browsers or devices, or log out."
2085,Sahi h bhai
2086,Alhamdulillah me bhi West Bengal ka district coochbehar se hu...
2087,"Gurgaon Haryana main bahar nikalne se aakh jaal raha hai abhi vi, aj K AQI 375 hai,"
2088,Bhi Main Niyamit pur main hun appke liye appje abhi live main bola Maine suna app kha par ho
2089,Aisa lag raha hai Chuna pot Diya use per
2090,Love you bhai
2091,Assalam alaikum bhai main v bangal ka hi hun alhamdulillah
2092,Bhai kal milki masjid juma padne liye aoge
2093,Bhai aap kahan mein ho kya Malda Town mein ho
2094,Neela Aasman dekh achcha Laga
2095,Bhai me ap ko ak video bhejunga ap os pe video bana
2096,Assalam Walekum Rahmatullahi Wa Barakatuh amla ka banta hai main bhi Bangal ka Rahane wala hun bhai sahab
2097,"Without a PIN, you could lose your chat history when you clear your cache, change browsers or devices, or log out."
2098,Throat ka band bja pda hai
2099,Hindu Rashtra Bharat mein sab changa si
2100,"Isme bhi sarkaar ki galti nazar ayegi logo ko bas khud ki zimmedari nahi Banti bas har waqt bechari govt ko blame Karenge Jo hamare liye itna kaam kar Rahi , I am with the govt and i want this govt to continue for next 50000years"
2101,"People of India don’t want to force farmers to manage their parali burning (30-40% cause of AQI)People don’t want to discard their 15 year old vehicles.People don’t want to shift to ethanol petrol because Gadkari son profit from it.Odd even number plate formula from AAP  also failed.Severe winters in Delhi with fog and moderately high level of AQI will be there, no matter how less the pollution is.City like Lahore, which has similar climate to Delhi, but has much less pollution and one third of the population still cannot manage their AQI.Beijing in China, despite all their world-class measures, still has more than 200 AQI (winters, population) etc."
2102,They used to make life of AAP govt hell now what is happening
2103,"Without a PIN, you could lose your chat history when you clear your cache, change browsers or devices, or log out."
2104,400 toh kab ka paar hai. Seems like typo error must be 1000
2105,"People of India don’t want to force farmers to manage their parali burning (30-40% cause of AQI)People don’t want to discard their 15 year old vehicles.People don’t want to shift to ethanol petrol because Gadkari son profit from it.Odd even number plate formula from AAP  also failed.Severe winters in Delhi with fog and moderately high level of AQI will be there, no matter how less the pollution is.City like Lahore, which has similar climate to Delhi, but has much less pollution and one third of the population still cannot manage their AQI.Beijing in China, despite all their world-class measures, still has more than 200 AQI (winters, population) etc."
2106,1000 hai AQI....ghnta 400...Upar se ye faaltu log bumb fodne lg rahe hai rojki roz
2107,Jabtak dharam pe vote doge tabtak zehrili hawa paani lete rahoge !
2108,Lock down karo ncr
2109,Bjp ko vote Dena sahi tha na
2110,kuch chu log aake bolenge ye sab population ke wajah se ho raha hai
2111,Wah modi ji wah Delhi ki CM ko bhi treind ker diya
2112,Rekha kaha ho tum
2113,Ncr lock down karo
2114,Modi hain to mumkin hain
2115,400 to kabka paar ho chuka tha.. they are never going to reveal correct aqi
2116,DiwaliMubarak hoSabhi logon ko
2117,"Par andbhakton ko pollution aur karna hain , kyonki hindu khatre mein hain"
2118,Fake news…. Please Delhi valo bahar ghumo and apna kam kro….Kosh ni hota trust tge government
2119,"Thoda aur hindu muslim hi jaaye … ye sab baatein to bekar ki hai ki pollution ,jobs ,inflation ,dollar vs inr , ye sab fizool ki baatein hai"
2120,Unread message:Hi! Please let us know how we can help you.
2121,Hi! Please let us know how we can help you.
2122,Hi! Please let us know how we can help you.
2123,Kaisa hai ansh
2124,Kaisa hai ansh
2125,Kaisa hai ansh
2126,AB Malik
2127,AB Malik
2128,Bhai animation kr skte ho app
2129,Bhai animation kr skte ho app
2130,Bhai animation kr skte ho app
2131,"Agreed! But why was there no protest when AAP was ruling? The air quality was more or less similar during his tenure, too. This clearly shows, Comrades got a breather with their recent wins in JNU...The government should take serious efforts to curb the rising pollution in delhi and at the same time should keep an eye on JNU!"
2132,Ya before this delhi air was cleaner than antarctica
2133,"Protest should be in this address. Mr. Chai wala, 7, Lok Kalyan Marg, New Delhi"
2134,Uss time Dhruv Rathee Bura lagda tha
2135,11 sal se kha the?
2136,One month na factory open air so cool
2137,"Now that's the true meaning of ""Ab jail ki kawa kha""..aab samjha"
2138,Commercial vehicles pe air purifier Lagao
2139,Prarthita Kar
2140,Prarthita Kar
2141,Prarthita Kar
2142,Prarthita Kar
2143,yeah youth ni hai chuttered hai yeah...
2144,Bro is Kumbh Karna wake up after 10 years
2145,Artificial rain ki demand karo
2146,Car chalana band kar do waise bhi delhi mein metro or e rikshaw bahut quantity mein hai wo use karo 1 mahine tak
2147,"Clean air chahiye jarur par travel cars ya bikes se hi karenge. Ghar me har room me AC chalayenge. Shopping karne kapde ki thaili nahi le jayenge balki polythene bags me saman layenge. Restaurant me Jake khana nahi khayenge balki order mangwa kar disposals ka dher banayenge. Sare ped kaat kar waha badi badi building khadi kar ke gamlo me do paudhe laga kar nature lover kahalayenge. Sari factories ka kachada sidhe nadi me dalenge.... Ufff itna sab kuch karne ke baad bhi inko clean air aur clean water chahiye, wo bhi sadako par jam laga kar... Hadd bewkufi hai? Corona k time me kaise pollution kam ho gaya tha. Waise hi abhi bhi public transport use Karo, plastic mat use Karo, har jagah gandagi mat phailao to apne aap kuch dino me pollution kam ho jayega. Par nahi.. inko to bas banner pakad kar naarebazi karni hai.. to Karo aur pollution se maro..."
2148,Sab protest par beth jao tab sayad pollution toda kam hojaye
2149,Diwali ban bolo aur
2150,Diwali me inn sb ne patake phode jo aaj protest krne aye hai 500-500 le k
2151,Pataakhe bhi chalane hain aur fresh air bhi chahiye
2152,Neeraj Dar
2153,Neeraj Dar
2154,Neeraj Dar
2155,Neeraj Dar
2156,"Kya sudh bayu, parliament mae ya assembly mae hai.Air pollution is created by general public."
2157,Ary bachre last 10 saal se ekdm clean air me reh rhe the ekdm se pollution aa gya
2158,Apne gaun jaa o......fresh air keliye....Crowded cities world over is the same...
2159,"Vehical movement in Delhi and pollution from industry was same as in the months from April to June was same and AQI was between 200-250 like other major cities in India.Then came July to Sep, same air pollution causes but the AQI at times went down to 85.Why?  Because of weather.Please understand the geographical placement of Delhi. Compression from Aravali and Himalayas create a vaccum like situation in Delhi because of which aur do not move due to winter. No rain can happen as no moisture due to winter gets here so no humidity n hence no rain.So the pollution remain in the air as movement is restricted.Then comes the stubble burning from Punjab area which makes matters worse worse.Delhi government present n past definitely need to take some actions which they even tried to take. But nature takes the driver seat her.So instead of blaming diwali crackers n stuff like that, study the matter n define a conclusion."
2160,KAHAN SE LAAYE TEEN CHAR DIN AADHI RAAT TAK PATAKEY BAJTEY HAI PER KUM HOTEY JAA RAHEY HAI HAWA ASLI KAHAN HAI NAKLI DOODH NAKLI PANEER NAKLI GHEE NAKLI ANDEY FAL SABZIA CHEMICAL AUR GATAR KE PAANI SE DHULI HUI ROAD MAP 2047 UP DEKHO TOH DUKH HOTA HAI SARKO PAR THOOKNEY KI SARKO PAR AAS PAAS GANDGI NA PHENKO KI SACHI PRAETHNA HI KAR DOH SWACHTA ABHIYAAN KE POSTER LAGA KAR PAISEY BARBAAD KAR RAHEY HO KYA KYA SOCHEY SIRF APNEY KO DEKHO MAINEY BHI KARIB DOH MAHINEY KOSHISH KI KI LOG SARAK KE KINAREY KOORA NA PENKEY PAR JINKEY LIYE YEH RITUAL HAI UN PAR KYA ASAR HAI KUCH NAHI
2161,"Hum  Sabko  NaJAISE  KARNI  ,  WAISE  HI  BHARNI HAI .Aaj  Nahi  Tho  Kal .JO  BHEEJ  BOYENGE  ,  USSI  KA  PHAL  MILENGE .BHAGWAN  Koi  Andha  ya  Behra  ya  Bewakoof  Nahi  Hain .Insaan  Insaan  Ko  Bewakoof  Bana  Sakte  Hain ,    BHAGWAN  Ko  Nahi .SATYAM  EVA  JAYATE .Jai  Kaashinadh .  Jai  Shree  Raam ."
2162,"Shuruat humesha khud se hoti hai,Sarkar humare samaj ka rk aaina hota hai.Bursting crackers on Diwali, lack of car pooling and heavy construction sites are major reasons on which no one is ready to compromise but need fresh air."
2163,Govt k paas bhot paisa hai. Hmare scientists ko paise do iska solution nikalne k liye. Jo best solution aaye usko apply kro. Learn from china
2164,Is protest me jitne log aye honge...Sala sab gadiyo se aye honge... Inko bolo ki apni gadi chhod de chalana... Or jo bhi demand kar raha hai fresh air ki... Usko khud se shurat karne ko bolo..
2165,Pehle kuda kachra kaha fakna hai yeh toh dekho khud ki ghatiya harqato par kaabu nahi hai
2166,"Sare Kam sarkaar hi karegi to Janta kya karega, Kya hum logo ki koi Dutay nehi banta, hum logo me civic sense namki koi cheez hi nehi hai, jaha thukna mana hai hum waha thukte hai, jara kura fekna mana hai wohi fekte hai"
2167,wo to Bechare ek Time ka Khana  ka b  Intezar Karte hain or Jo Insaan Log Katra  Karte hain Dogs Bechare  ume Se Hi Kha Ke Pade Rehte Hai koi ek Waqt ka Khanna  to nai deta hai magar unko  Marne  aaja te hai ￼
2168,Kejriwal ko bolo Punjab me parali jalana band kare. Kyunki usne hi bola tha ki delhi ki pollution ke liye Punjab ka parali jimmedaar hai.
2169,Kaun dega bhayi clean air iske liye v jimmedar to hami log h population kam kro aur ped paudhe lgao...aur kr hi kya sakte h
2170,sahi cheez ke liye protest kar rahe ho bilkul clean air sbko milni chahiye par iska illag government aur public dono ko milke plan karna chahiye pollution kam kaise hoga aane vale time mai gas chamber hojayege delhi aur hum sb marenge aur kuch nhi hoga iska sollution dhoondo plant trees spray water ban every vehicle for one day in a week cycle ya electric vehicles ka use ho only only electric vehicle use for one day in a week try karsakte hai
2171,"Protest karo bhai but politics karke pure protest ko barbaad mat karo, ab polution ke liye bhi adani and ambani ka naam le lia..."
2172,Shi hai kutto ke liye jaise rode pe nga nach kiya tha waise hi apne life ke liye kro aise basic rights ke liye kro tb hi kuch hoga. Government koi b ho basic rights china ja rha ho to uska virodh kro
2173,Jub trees ko kata jata he to tum log aramse ac me soye rehte ho.ub bhugto earth ko jitna nature ur natural elements hona chahiye utna wapas karo warna maro.earth dhire dhire mar raha he concrete marbal tiles buildings where is nature to kya hoga abhi to picture baki he thoda ur badmasi ur nahi sudhroge na tadap tadap ke maroge .abhi tum log mother earth ko tadpa rahe ho uske baad humans bhi tadpenge
2174,Phele to Kejriwal ko gaali dete the sab milkar ab kya ho raha? Humari new government kya kar rahi hai bas chuup kar bethi hai clean air mei
2175,Khushi Kumary
2176,Khushi Kumary
2177,Khushi Kumary
2178,Khushi Kumary
2179,Pakistani or bengladeshi k liye koi nhi aata aise
2180,"Protest mat karo bhai ,mana hae .Andari dal denge phir bolo ge mujhe air do .air do air do ( Clean bhool jao ge)"
2181,Clean air lekar nachaniya ka nach dekhne jayega
2182,"Clean air koi de nahi sakta ,  sabko self discipline aur knowledge ka use karke aur Rko aur toko se ho sakta hai"
2183,Khushi Kumary
2184,Khushi Kumary
2185,Khushi Kumary
2186,Khushi Kumary
2187,Jhuggi jhopdi htegi tbhi safai hogi
2188,Aur patake phodo clean air milega
2189,Tum logo ko clean Air milega bus apna sans lena band kardo 10 minutes ke liya.Ram nam satya hai.
2190,"Protests karne se kiya air pollution thik ho jayega...industry rahegi, over propulasion area mai hur koi bNda gadi kharidke salayega fir polusion hoga na baba... Sab kuch nikal feko.. Cycle chalana suru kar do..."
2191,"Apne apne car,office aur ghar ka ac band ker aaj se pollution kam karne me madad karen!"
2192,Log kamane pr dhyan denge to yahi hoga ....... . . . .ab jis k pass Job nhi hai Vhai Road pr utar gaye
2193,"Ooh bechara pichhle 12 saal tk 1200 aqi me v zinda the, avi 500 aqi me tumhe heart attack aa gya, aur kuch log diwali k liye chhati pit rha hay jaise diwali ki wjh se hi unki amma mar gyi, khud sal me 12 mahina ac chalake mze se rhte hay tb inki amma nehi mrti, aise logo k liye 'om shanti' bhagwan inn jaise hindu virodhi jal kukdo ki atma ko shanti pradan kre"
2194,Pichle saal nhi chilaya ja rha clean air do .....
2195,"Ye log 500-500 le ke protest kar rahe hain, ya aap log 500 -500 leke comments kar rahe hain."
2196,Patake or fodo sb clear ho jayega
2197,Delhi chodo.ab nahi sudarsakta.
2198,Delhi police aur Kar bhi kiya Sakti hai
2199,"Abhi to sab changa si tha,Abhi inlogo ko kya hogaya"
2200,It's dirty politics from Aap..sirf nautanki hai.. Diwali ke 20 din baad bhi patako ka pollution haha are you guys serious or joke factory..out of mind..look at first Punjab cities aqi first then talk ..all planned political agenda.. look for solutions.. inse koi puche life me kitne tree planting kari hai abhi ..kitna plastic kam use kiya
2201,Salo ek gadi pe ek admi ghum rahe ho aur ped kisi ko nahi lagana hai pollution kam nahi karna hai aur tumko clean ais chahiye
2202,Andhbhakts ko isse kuch farak nahi padta
2203,Shushat case vs delhi pollution ek taraf bollywood walo ek taraf mudha hai bhai bihar ka he banda nahi aisa chodenge ham arnab ji
2204,Ye good life jise khte ho na ye isike side effect hai
2205,Ye delhi k bevade aur rappist log jab khujliwal CM tha tab kaha mar gaye the jab uss waqt pollution tha
2206,Badwo ko faqak nahi padega unka swarg duniya hai tak hi hai
2207,Isliye Delhi m dhamaka to nhi karwa diya taki sab muddo se dhyan bhatak jaye
2208,Patakhey ..tum phodogey .  Sarkar pure air degi... Kaise bewakoof janta hai desh ki.. air pollution per khud hi kam karna padta hai .  Warna din door nahi jab ye desh murkho ka desh khlayega ..
2209,Aap k jate hi activate ho gaye ...wah guru
2210,Diwali me patakhe fod ke air ko kharab kiye ho ab sarkar ko dosh de rhe ho
2211,Pataka phodne wali didi kahan hai
2212,10-15 saal se inko AQI nhi dikh rhaa tha kya tab kaha the ye sab tab kyo nhi bole tab bolte to abhi tak bahut kaam hota.
2213,Chutiyapa hai bas ye sab
2214,Delhi jo desh ki rajdhani jaha saare mantri Or PM rastpati rahti he us ka kiya haal kar diya b j p ne
2215,"Clean air do,,,,koi product h na Kya Jo demand kardya,,,,better plant trees ,,,than demanding,,"
2216,"Avi sab kitna gyan pel raha hai, kejriwal k time ye gyan k bare me padha nahi tha sayad!!!!"
2217,Phle patale phodo phir baad protest kroLde ka rkha civic senseyha pr
2218,Bas ek sawal in sabhi se puche ko Diwali mein kya kiya inloge nein
2219,Jo bhi andolan kar rahe hain pahle police ye jaanch kare ki inme se kitno ke pas vehicles hain aur kabke.
2220,Kya baat hai…Ise kehte hain Governance. Kitne arrest kiye…FIR mein kya likhoge
2221,Poster padkadne se aachapedh paudhe lagao!!
2222,"Pehle Jo itna gambhir mudda hai jo,wo solve ho jaye.Dogs ka mudda.polluted air se koi nahi marega bhaiyo, kutte kaatne se marenge log."
2223,Modi ko chuna haiPhir Keya protest vaaiWoh India ko biswaguru banayaDuniya me Bharat ka danka baaz raha haiNacho
2224,Clean air baad me hoga bhai. Pehle sab milke terrorist ko clean karte hai.. air cleaning se bahut jyada jarurat hai terrorists cleaning..
2225,"Without a PIN, you could lose your chat history when you clear your cache, change browsers or devices, or log out."
2226,Koi baat nahiIsme logo khud ki adate change karni chahiye govt to bechari kaam kar Rahi hai. Khud public ko bhi badalna padega Kya thoda zherili hawa me saans lelo ham apne desh ke liye itna nahi kar sakte Kya ?
2227,"Jai Shree Ram, Patakhe to hum phir bhi jalayenge."
2228,"Happy DiwaliSaare ke saaresab ko happy diwali""""सबको दिवाली की शुभकामनाएं"" या ""सबको दिवाली मुबारक""।Bump pathaakhe Mubarak ho"
2229,Air ka nam vayu karo. Sab tik hojayaga
2230,Jay shree ram aur patake fodho
2231,Jai ho modiya
2232,Jai ho Modi ji
2233,but then Delhi  meri  jaanI loved dili..especially  the way towds  Gurgaon via cannought place
2234,Wah rekha gupta wah
2235,"Without a PIN, you could lose your chat history when you clear your cache, change browsers or devices, or log out."
2236,"Ye videshi takaton ki chaal hai... Ye pollution nahi hai .. ye ghar ghar bante khane ki mehak hai to fog ke saath mix hoke faila hua hai... Plus point ye hai ki isse dushmani taakatein humein nahi dekh payengi na hi humare kaam ko, kyunki hum ab is ghar ghar se ubhare bhartiya badal mein chipe hain jisme koi satelite humein nahi dhundh saktaWaah modiji waahIse kehte hain viksit bharat#lenidenikardibjpne"
2237,Yahi toh Amrit Kaal hai! Jai Shri Ram!
2238,"Sari corporate company work from home kardo sari cab facilities band karo pollution khud hi khatam ho jayega, kejriwal ko chahiye ke rekha gupta ji ko advice kare."
2239,25th ki public holiday declare ki h CM ne but private schools mein koi holiday nhi h 25 th November ki School se notice aaya h ki holiday only government sector ki  h..ek kaam kiya wo bhi dang se nhi
2240,Moodi be likeSab Dhooyaan Dhooyan kardungaFir dhooyen mein main dikhta naa......
2241,Bhai Hawa nhi mandir chaiyeeee Jai bjp
2242,Modi ji ki granite ha sab kuch hoga.jo kabi nahi hua ab ho raha ha. Phir chahe koi dhaj ma laya ya apne gaon se laya ha
2243,Kuchh nhi hai system fail hai Delhi ka
2244,"Apne munaafe ke chakkar mein kisi ko na baksho, har local offender ke bank account seal kardo aur property bhi buldoger kardo , bade industrialist ko kuch mat kehna woh sab bahut acche hein na"
2245,"Schools are open , small kids are going to school daily. Bachho tak ki to padi nahi hai kisi ko. Baki sab articles me bahut kuch chal raha hai..."
2246,"Haan to ye kachra, gaadi govt ki den nahi aap sabki hai.. govt ne to chhupaya hai.asli AQI level janna hai to get your own AQI monitor and see for yourself."
2247,AB KYA KHANA KHA KE FAT MARNE PR CHALAN HOGA
2248,"Without a PIN, you could lose your chat history when you clear your cache, change browsers or devices, or log out."
2249,"Haan... festive fireworks that lasted for 3 days, with each day lasting for about 4 hours.... and those old diesel buses, autos,  jugaad gaari (thelaa gaari motorised with diesel generators) running havoc around the city and the unchecked 4 wheeler boom has nothing to do with"
2250,Hota hi to hone doItna environment ka dikkat hai to baki chiz ko bhi control kro
2251,Diwali ke baad hi aisa post dekhne ko q milta hai...why don't people use bicycle instead of cars and bikes
2252,Bhai ne 2015 ki photo use karli 42 nahi dikh raha
2253,"Thik ... fireworks is the major reason, and those 'jugaad van', horrible conditioned yellow taxies, buses... no way... its fireworks.."
