,Hinglish_Comments
0,I'm all in. Harley queen se milne ka sapna bhi pura ho jaega.
1,Kirmada homie hei thoda misunderstood count him in as well
2,udaipur during winters? lmao bhai 3-4 degree jaata hai thaand mai jhel paoge?
3,"chandigarh, indore, bhopal (civic sense ka nahi keh sakte, chutiye log toh har jagah hote hai)"
4,Delhi aao bhai. Aapko Chandigarh jannat lagne lagega
5,"mai toh tier 3 me rehta, facilities bhi almost saari hai, less pollution no bheed bhaad mast badhiya life"
6,Demand Kuch jyada hai apki .
7,aapki expectations bohot kam hai tax kyu dete hai sab
8,Jitna tax de rahe ye to basic sabko milna chaiye.
9,"Bhai healthcare bhi include kia hai 
Waha hr cheez to struggle hai
Simple water and groceries"
10,"Bro delete Maadi crowd jasti agutte, delhi na pollute maadi illu ade thara aadthare"
11,"Indore  ?? Bro the news i am watching about indore and Bhopal ..It seems you guys are the most regressive ppl ..Recently bajrang dal catching couples checking their adhar card ..ppl offending on santa Claus costume ..Moral policing ..This extremist outfits shuts the shows of diljit, mc stan many stand-up comedians ..ew what the shit city man"
12,konsi road hai bhai?? konsi cleanliness??konsa civic sense?
13,"Bhai logo ki mat sunna , Bhopal is greatest place to be in ….. sukoon hai , you will have luxuries too wo bhi affordable, a lot near to nature"
14,are yr main krne hi wala tha ye
15,UNESCO. Bahut proud feel ho rahan hain
16,"na equally worse 

150s right now

[https://aqicn.org/city/india/](https://aqicn.org/city/india/)"
17,it's game of perception . we make 150 normal which is dangerous bcz hazardous effect doesn't slowdown . it's just we don't feel it . in our place if aqi increases than100 we go to amc and nagarpalika directly . simple hai bureaucrats and politicians ki gaand maaro . democracy ke gine-chune faayde he . use it
18,Ye vishwaguru hai. Yaha mar aisa hi hota hai
19,Wahi raho bhai saaf hawa lo aur fresh fruits sabzian ugao. Baki sab moh maya hai. 
20,temperature list mai rahega
21,Topper hai hum! /s
22,Har baap ka ek baap hota hai
23,Aur usko ham dadaji bolte hai
24,Mandir ke jagah ispe focus kiya hota..🤦‍♂️
25,5 to bhai NCR ki hi ho gayi. Usko 1 hi count karo.
26,Aur do modi ko vote
27,IIT geniuses kuch invent karo!
28,Kaha chale the super power ban ne 😅
29,Kahi toh Vishwaguru ban gaye humlog. This is the collective failure of Indians and every successive government in this country
30,🔥🔥🔥 what an accomplishment! The funny thing is most fucking Indians don’t even give a shit more worried about religion . Too self centred to give a shit about actual issues which means the government doesn’t give a single f. The Indian oligarchs are too entrenched with the government to even tweet about this. Chalo let’s watch India vs England
31,Hooo tbhi socho tears ekdum se kyu arahe thy socha breakup ke karn thy but reason ye hai 🤔
32,asli pataka toh bhai ke saath phata
33,Silent pataka tha but damage bohot hai 🙂
34,Aape toh surgical strike ho gyi🥀
35,🙂 yaar haso mat dill gya hai 🙂
36,Don't be stressed dilli walo ka dil aata jata rha hai
37,"I'm literally ordering one in the other tab. Dekhte hain wo bhi kya karlega. I've always thought it's a waste of money and won't do anything but whatever I guess, try to karte hain."
38,"I'm getting the Xiaomi Lite. Beijing me bhi AQI kharab thi ek time pe to I'm assuming battle tested hai lol.

If you have more money to spend I think Dyson is the best."
39,Lagta hai lavde lagne vaale hai 😎
40,Lag gaye hai  🤣🤣
41,long term mein RIP tho
42,"Govt toh bekar hai hi, but yaha ke log kya kam hai....I feel people are more to blame coz jab logo ko hi khud ki dusro ki and environment ki nhi padi toh govt toh fayda uthayegi hi. So congratulations to all those people who followed their so called tradition, you deserve this."
43,bruh patakhe phodna isnt a tradition. diye jalana is. in logon ko compare karna hai ki how saare environmentalists diwali ke time pe hi aate hai. pehle khud ki condition ko to dekho.
44,aur agar tradition hota bhi to bhi galat ha.
45,Actually it's not only about burning firecrackers but it's also about the attitude of people. Pata hai hamare desh ki population itni zada hai fir bhi sabko individually patakhe phodne hain. I don't support burning firecrackers but agar ek family jisme 5-7 log hain limited patakhe jalae ya ek building mein sirf kuch log hi thode se jala lein to at least itna zada nahi hota. Ye main isliye keh raha hon kyuk log manne wale hain ni and koi band nahi karega patakhe phodna. Ye har sala ka yahi scene hai. Limite karne se kuch to faraq padega hi.
46,Weirdly enough jinhone 10-12 hazaar ke patakhe fode honge unke ghar mein dikkat nai hogi medical ki. Dikkat hogi dusro ke ghar mein.
47,Bhai artificial barish hee karado
48,Cloud bhi toh hona chahiye uska liye.
49,"Maine kaha cloud hain, baarish hain benefit milsakta hain kya?"
50,Fir acid rain hogi turant.
51,"It’s okay, Dhruv Rathee needs to be proven wrong. Hamare lungs kharab jo jaaye koi baat nahin but Dhruv Rathee can’t be right. In Germany also they burst crackers, what’s your issue? 😡"
52,I've seen this thing happening a lot recently. Typical bhakt behaviour ki apni ghar main aag laga do if it means leftists will cough from the smoke. 
53,Modi actually successfully rotten their brain 2014-15 jo banda 4-5 bam fhodta tha aaj ke time wahi banda 40-50 bam fhode ussne
54,Fucking morons get offended agar bol Diya apne sehat ke liye may jalao. Insecure dharmrakshaks
55,"""Ruko zara, sabr karo"" meme comes to mind. 

Us Hyderabadis should learn from their mistakes. The population of Hyderabad too will keep increasing thanks to the IT industry and stuff. So the pollution too will keep increasing. As they say, prevention is better than cure. I hope Hyderabadis are more sensible than the chauvinistic mob of Delhi who elected these fools."
56,"Bhai gala gao yahan tabiyat se !! Patake koi aur jalaye,.doctor ki fees hum bhare. Lagta nai next time delhi me rukna nahi hoga isa festival me. 😢 😭"
57,I'm a Hindu aswell but i never seen in any Hindi book jismein bola hai u have to brust crackers it's something we created it not our ancestors In religion diwali is festival of lights not a festival of pollution and noise pollution... People lack to understand that and mujhe gali padegi ik 🙂
58,agar tradition h bhi to bhi kyu fodne h
59,Yes but it's a festival that comes once a year to celebrate karna chahiye but safety plus common sense ke sath aur limit mein not too big and too much
60,Bruh almost 300 aqi toh Ghar ke andar he hai
61,"Arre nahi bro, stubble burning hui thi achanak 8pm pe, uski hawa aa gayi. Pathake toh fodenge, kyuki usse kuch nahi hota. Tu anti-Hindu hai aise post kar raha hai. Diwali manao, pathake udao. Mughal tradition tha toh kya hua, ab toh humara hai. 2024 mein 10,000+ stubble burning se 2025 mein 250+ cases huye toh kya hua? galti saari kisaano ki hai."
62,Bhai patakhe kabse “pro-hindu” ho gye hai?
63,Janta se poocho
64,Bhai patakhe kabse “pro-hindu” ho gye hai?
65,"Diwali to saal mei 1 din hoti h, uska effect thodi rahega. aur new year par bhi celebration hoti h uspar tum kuchh nhi bolte/s"
66,Yeh anti-national hai AQI wale
67,"Ah yes, ""Rukne ko bole to wo aur karenge"" sure sure. The solution sure is to just give em full reign. Idiots"
68,itna problem hai to go to pakistan /s
69,Aur do bjp ko vote. Bhen ko laude sab dharm ke rakshak
70,M to already beemar Ho gya
71,"If crackers weren't so damaging to the air, I wouldn't have an issue with it.

But people burning firecrackers for Gods are causing the other death of other people who perhaps didn't burn itz landing them in hospitals and making their lives hell.

If that is the kind if God they follow, for whom you need to harm people to make them happy;

You are better off not following such a cruel God.

But all those arguing that bursting firecrackers and killing others is not an issue are not even following their own culture and tradition.

They are just following a religion heavily changed by foreign cultures, so much so that not even a drop of what being a hindu means remains.

Firecrackers are a chinese invention, burn diya instead. Don't use lights, use diyas in every nook and corner of your house.

Ghee diya is even so useful with avoiding mosquitoes, and it is expensive but not so much as lights ki ladi and firecrackers.

Instead of wasting thousands on firecrackers that are killing people, use it for charity. Krishna wasn't an idiot for asking Arjun to kneel before Karn the daanveer, your god must have thought of something valuable.

Nobody cares about a religion full of symbols and no ideals, you are making a joke out of our religion.

Stop polluting my religion with your cheap mindset.

If you want to kill someone, kill your own family and burn those firecrackers inside your house.

Nobody should be burnt or die because of your foolishness.

Also, stop insulting my Gods with your ignorance."
72,Arey bhai 1000 kaise dikha rha the sources ? Rohini mai toh 500 hi dikha rha tha subha
73,"Kabhi kabhi lagta hai ki accha hai ek tier 2 town me rehta hu, diwali ke baad bhi 80 aqi"
74,Sanatan dharm ka apmaan nahi sahenge...
75,Galat data hai live check kr lo max delhi 500 hai website-&gt; AQI-live
76,"Wait up, today it will be in the 400s during the day and the same people who went crazy bursting crackers last night will say, 'Ab toh kam ho gaya, itna seh sakte hai.'"
77,Bc 2000 !!!!! Is it even possible ???
78,"Kuch nahi hone wala jisko jyda dikkat hai Delhi se nikal lo, waise bhi Delhi ki CM bol chukin hain:- ""Apne Risk Pe Aayen"""
79,Govt's decision to allow fire crackers was problematic. But where were my reddit log before Diwali.
80,"Guys, My question is that Last year, This level of pollution started even before Diwali came, long before diwali came which showed it had no relation to it and it's rather Stubble burning. I agree that Diwali does play a role but poora blame diwali pe daalna is also wrong"
81,Chernobyl kya kehta hai 🗣️
82,Vishwaguru ki jashn aarambh hoooooo😂😂
83,"I’m from punjab here is AAP govt, Did previous government (Kejriwal) does something regarding this Pollution or Not?"
84,Govt is at fault for many things. This is not government's fault at all. It is the fault of people who kept saying ki ek do din patakhe phodne se kya hoga. Ye hi to hona tha.
85,"Bhai where y'all bringing this fake data from. I can't believe this

If the aqi had been 1000+, we wouldn't have been able to see shittttt. Smoke all around. Y'all are so cooked for the stupid braincells you got. Oh man

https://preview.redd.it/rotsg2fujewf1.jpeg?width=1080&amp;format=pjpg&amp;auto=webp&amp;s=bf7a4f2cba968f62befb5d711b6a2380456d6b38"
86,"Well AAP govt itself tell them when to burn,when satellite moves 

And who are recording these burnings? We all know the answer
Satellites like NASA's Aqua and Suomi-NPP are used to monitor stubble burning using instruments like MODIS and VIIRS, which detect fires through visible and infrared imaging. However, these polar-orbiting satellites only pass over a region twice a day, leading to concerns that farmers time stubble burning after the satellite's overpass to avoid detection. Geostationary satellites, like the South Korean GEO-KOMPSAT 2A, can provide more frequent, continuous data that shows spikes in fires in the afternoon, supporting this theory. In response to the limitations of polar-orbiting satellites, Indian Space Research Organisation (ISRO) uses its own satellites, such as RESOURCESAT-2A, and is developing new systems for better accuracy."
87,"Mere poorvajo ko gao mea hie rehna tha ,, waha pe rehte tao saaf hawa milti and kheti wali zameen bhi multiplies crores ki hoti"
88,Ab pachtaye kya hoyi jab chidiya chug gayi khet.
89,"Celebrities ki awareness me jo hamle g madai ki thi....par ek angle se sahi the. Sab ek hi din pollution kare to acha nahi nai.


Kabhi kabhi celebration hone wale se."
90,Gobi h toh..... aloo h!
91,"the problem is much more bigger than burning of firecrackers, this could be they governemt way of blaming it on firecrackers because they have again failed to find solutions for air pollution and it might be the reason as well why SC allowed it maybe to hide the governement because gov knows people are going to blame firecrackers and when the weather clears a bit everyone will forget but the main issue will still remain there, because not in every city you burst crackers and the air quality goes to 1000 even in my place we bursted crackers till 10pm but in morning the sky was as blue as it can get with 65 aqi but still im saying the problem is much bigger and you have to unite to know the real solutions"
92,"Ab to nuke bhi gira do delhi par , phir bhi log normally chlate hue dikh jaynge"
93,Bhai lekin patakhe fodne me mza aaya
94,"Mata, pitaa: hamare bete ne bahut achha kaam kiya hai. 

Log: bahut achhi baat hai, kya naam hai apke bete ka?"
95,"&gt;Log: bahut achhi baat hai, kya naam hai apke bete ka?

Irl name hi bolenge na!"
96,News article me IRL naam to nahi hai na. Only way he can get credits IRL is to link IRL name and reddit username
97,TV pe naam aagya 🤩
98,"Bhai, is Anna conda your gf?"
99,lets fcuking go  issi baat pe muh me lele bc 😂😂💀
100,Delhi wale sub ke ek post ko bhi cover kiya tha ek news me bc mera comment deka rahe the username hide karke![img](emote|t5_2qp7h|51086)![img](emote|t5_2qp7h|51086)![img](emote|t5_2qp7h|51086)![img](emote|t5_2qp7h|51086)![img](emote|t5_2qp7h|51092)![img](emote|t5_2qp7h|51092)
101,Bc uska username dikha diya tera nahi essa bhedbhav kyu
102,Mere jaise sareef logo ke saath essa hi hota hai ![img](emote|t5_2qp7h|51086)![img](emote|t5_2qp7h|51086)![img](emote|t5_2qp7h|51086)![img](emote|t5_2qp7h|51086)![img](emote|t5_2qp7h|51086)![img](emote|t5_2qp7h|51086)![img](emote|t5_2qp7h|51086)
103,Pdh apke irade to thik nahi hai Phir kesse sharif
104,I hope not lol. Ho jaati hai galti. It's also 4 days old now so no one seems to have noticed so far. I found it when I was watching today's newslaundry episode on youtube and I saw this article. I couldn't stop laughing lol.
105,Ya glti ho jaati hai vaise bhai kya sochke apne ye behtareen username rkha 🤨🤨
106,Mujhe lga ladki hai 😔😔
107,Muh mein chappal nahin chahiye mujhe
108,"Sahi baat hai, muh mei toh aapko kuch aur chahiye ![img](emote|t5_2qp7h|51093)"
109,![img](emote|t5_2qp7h|51088) kyun nhi ho rhi proof reading
110,Ah yes. Wonderful investigative journalism by *looks notes* muh mein chut 69. Thank you kind sir.
111,"LMFAOOOO

muh mein chut 69 😭😭😭 in national news is not something i expected to seee, funniest shit ever"
112,block kar deta hun lol
113,Bhai- 💀💀💀
114,"Indian Express kya ye haal hai, toh phir toh it's over"
115,"bhai 🤣

congo"
116,"Bhai thode din pehle Mera dost mere sath ladra tha online news articles ke upar, me usse bata rha ki news articles pe itta easily trust nhi kr skte kyuki kafi bar ye news vale reddit se hi utha lete h bina kuch Jane puche"
117,Getting muh mein chut dream of every middle class boy
118,wow MMC bhaiya
119,Kuch meetha ho jaaye.
120,Famous hone ka tareeka thoda casual hai![img](emote|t5_2qp7h|51097)
121,"Congratulations OP!!! 
And to that reporter if you're lurking here: Bro thoda toh competent ho jaa!!"
122,Areee🤣🤣 lol Chalo achievement to hai vaise ![img](emote|t5_2qp7h|51086)![img](emote|t5_2qp7h|51097)
123,Bhai autograph dedho abhi
124,Bhai autograph milega kya
125,"Congrats. Ab kabhi toh milegi tumko muh mei. So many people will read it and manifest it.

Edit-this post is now on r/ popular as well under ""rising"""
126,"bhay chapne se pehele thoda username hi padhlete, atleast kuch alag naam daaldete"
127,No way they wrote muh mai chut 69 in a published article.. wtf
128,u/ ki jagah @ use krne ke liye mai patrkar ko tahe dil se shukriya ada Krna chahunga
129,Hadd hai bc 😭😭😂
130,Indian express walo ko hindi nahi aati he kya?
131,bhai mera na aa jaye kabhi
132,Lesssgo bhai😹😹
133,muh mein what bruh...
134,Did they really not see ur reddit I'd Bina samjhe chaap diya bas 😆😆😆
135,Bc 1000💀💀💀💀
136,Kal ki h btw
137,Wtf varansi is that much? Itna to lucknow ka nhi hai
138,"Dev dipawali 🥀🥀🥀



Diwali se jyada toh usme pollution hua :("
139,"Bihar me bhi yhi halat hai

https://preview.redd.it/twv74vjk2d2g1.jpeg?width=1080&amp;format=pjpg&amp;auto=webp&amp;s=06212361b64bab3abc2bcc40de2bd5f97935f721

Plus yha 99.9% log mask nhi lagate hain"
140,Ye surrey kaunse continents me padta hai dost ? Asia ka to nhi lagta 😖😩
141,Bhai hukke ki unit conversion kese hoti koi idea?
142,Delhi meri jaaan always 700+
143,Mat kr lala mat kr
144,mere city toh list m hi nhi h..... lagta h yha bhi cutoff clear nhi hua
145,meri wali kuch point se rah gayi
146,Yha bhi reservation bc
147,"yaar pata nhi maine toh bahut jaye the kal puri family ke saath fir bhi bs 300 tak hi jaa paya, koi ni agli baar koshish karunga"
148,Karo bhai. Kuch help chahiye to batana. Hum aa jayenge waha
149,"paisa kon dega?

but seriously, i went to market yesterday and rates were so damn high. cheapest anaar packet was 120. who tf buying these crackers"
150,Meri rank 40 ayi 🥳 kya mera selection hojayega
151,"Every city is from south aisa 
And it's 98% india here 😭"
152,ye aqi ka diwali ke baad kyu aata h??
153,Bolde bhai bolde aj dekhi jayegi 
154,Sab prapoganda hai bhai ☝🏻
155,W! Ye hoe na baat pure saal sala AQI High reheta hai pr RR enko dipavli ke time hi machana hai 
156,"coz AQI actual mai bhad gya hai Diwali ke baad 

phir bolenge hamare festival ko kyu blame krre ho"
157,Kyuki farmers apni crops ka stubble burn karte hai
158,"but like why?? why cant even today we havent buidl technology which can replace stubble burn, especially its a main polluting problem for delhi?"
159,"Kyunki diwali ke baad sab pareshan ho jaate hain. Ones who don't burst firecrackers but still need to breathe the same air. Last night couldn't sleep till 3am coz of loud bombs and looms. And I have a cough today. I was seriously researching why no one is implementing the firecracker curfew which was supposed to be allowed for only 2 hours. 

I used to enjoy Diwali so much as a kid.. but these days it feels impossible to breathe. Don't know if it's the firecrackers quality or what, but it used to be different years ago."
160,"Parali burning + firecrackers, ye parali burning nhi rukwa paa rhe, aur hm ek din patakhe bhi na fodde?"
161,"""vo to galat kaam kar raha hai mai bhi karunga"" banke cool banne wale log"
162, Mai toh phodunga... Custom tuned banwa ke phodunga
163,"Bhai poor hi phodte hai ,ye elites nhi phodte hai isiliye itna activism karte garib ki ek din ki Khushi Dekhi nhi jaati"
164,"low level indogangetic plains, dense hava neeche settle hojati hai, parali jalti hai, industrial smoke, etc

firecrackers burst nhi hote tab bhi bahut pollution hota hai"
165,"No access to sea, low wind speeds, Mountains surrounding you on all four sides and stubble burning. Firecrackers are not even the main reason, though they do play a part but here its mostly geography. AQI of these cities remains high weeks before Diwali."
166,kurukshetra mai sahi mai mahabharat hua tha kya kal?
167,Yaha bhi selection nhi hua
168,"IIT Hogaya bhai ka 

Cse?"
169,"Haaan ab toh cse paka hai

https://preview.redd.it/ftpwpb4brewf1.jpeg?width=928&amp;format=pjpg&amp;auto=webp&amp;s=c026846a48c1d4f6459e735fdd0670fe50fca136"
170,meri city top 100 me nhi hai
171,3rd hu bhai
172,Competition kuch bhi ho Pakistan se nahi har an hai 🗣️🗣️
173,"lmfao bhai, it really has nothing to do with diwali. Most of it was already there 1 week before it. Just search it up, delhi was only 50 points lower a week ago and this list was pretty much the same. Pollution in Noida increased by only 5 points after diwali, like tf? Its just geography, theres no pollution in bengaluru even with the firecrackers is there?"
174,in logo me itna dimaag Hota toh nahi bikte firecrackers
175,"Mid-level cities from UP like Sitapur, Banda and Etawah are also on the list 🥀🥀"
176,"Top 200 deekha

mera aaya toh 2~3 aur bomb phor dunga"
177,Yayyyy 99th pr mera city heee 🥳🥳🥳
178,97percentile se kuch nahi ukhaad payenge. 99.99 toh chaiye hi
179,Bhai top 200 ka dekha to Mera city waha hoga sayad
180,Chalo khai to top 3 aya
181,AIR 30 YAAAYYY YAHA TO CUTOFF CLEAR HO GAI
182,"Chalo Meerut ne toh cutoff clear kar liya, logo ki mehnat rang layi 😂"
183,Yaar ye 700 vale figures kaha matlab kaunse website pe dikh rahe hai ?
184,Yaha bhi selection nahi hua
185,"Na winter achha hai, na rainy season achha hai, summer me gand ka guldasta ban jata hai🥀🥀"
186,Kurukshetra haryana ? Bhai yaha to nhi par itna pollution
187,kanpur nahi hai isme 🤣 yaha toh industry bhi hai
188,Pakistan aur Nepal me bhi yaha se dhua chala gya hoga vrna 100/100 hota.
189,Yesssss Abhi Or Mehnat Karni hai 🥹😕
190,IDHAR BHI JHARKHAND NAHI HAI ?😭😭 Jamshedpur bhi nahi dekha .
191,"If we all work together we can achieve this. 
Kisi chiz me toh age hone chaiye atleast."
192,Indore ese kaam me pata nahi kese gayab ho jata he 🥀🥀
193,"Bhai galat data hai, Jhunjhunu, Rajasthan list mein nahi hai unka 235+ chal ra hai. Ye log daandhali kar re hain. Cheating!!!"
194,Isme mumbai kaise nahi hai🙏🙏
195,Shahar walon ko batana padega list me entry hai hi nahi😠
196,Meri city 99 number pe h
197,"Yaar yaha bhi meri city nhi hain 🙏

Har jagah mere patta kat jata hain 🥀"
198,"Modi, modi, modi hai to mumkin hai."
199,aur phodo pathake
200,Mere patako se hi mera seher Aaj top pe hai 😋 Jaa Raha hun aur phodne
201,"Diwali ke baad AQI metrics post kardeta hu, cool lagunga ☺️"
202,Kurukshetra pehle pe😂😂 i live here
203,OP ek bar AQI wala map open kar ke dekhna
204,meri top 10 rank nhi aayi!! got rank 11!! whyy??
205,Both are in tamil nadu.. They just boarder with KA
206,Yeah they are in TN but get significant chunk of their demand from KA.
207,Geography and stubble burning are the main reasons.
208,"Bhai not true, I stay in Hyd and crackers we’re busting all night yesterday. 
AQI in my area was around 300."
209,"reduced consumption is the main cause, but also just great wind in general. The north kind of almost has no winds right now. I think give it a couple days, and the effect of winds would be more clear if this is actually diwali effect or stubble burning"
210,"Yeh sab German Shepherd ke wajhe se hua. 
Na woh bolta mat jalao crackers na gadhe double kharcha karte fire crackers pe."
211,RAAT KO PATAKE BHI TO KHUD HI FODE THE. TOH AB AANAD LIJIYE.
212,"Modiji bhi diwali ke din delhi chodh diye , tum kya cheez hoenbhai"
213,Konsa app hai? 
214,Hindu khatre mei hai ke chakkar mei Hinduo ko hi ji khatre me daal liya 😭
215,"diwali 2022. my nanaji was diagnosed with lung cancer.

2 days after diwali 2022. my father suffered form severe asthama attacks twice before we reached the hospital.

fortunately they are both healthy now.

lekin mereko iss sab se kuchh farak nhi padta. chahe mera baap mare yaa fir mera nana. tumhara hindu dharm to bach gaya."
216,"literally 0 relation of Hinduism with crackers
bs moj marni h , apne aap ko problem kabhi hui nhi, to koi na koi reason chahiye 


even bhai moderation me krlo, alot of varients of fooljhadis and aanars dont even do much but nahi"
217,"truly diwali has no relation with crackers aur jalane bhi hai to 1 ghanta jalao 2 ghanta jalao , ye log puja to karte nahi par ek hafte pehle se patakhe phodne lagte hai"
218,true. log apne ego par leke chale gaye hain.
219,Bhai vishwaguru ban ne k liye itna to kar hi sakte ho
220,"VishwaGuru.

It's controlled cleansing(of old people and unhealthy people) to lessen the burden on the economy. Kam population = Higher per capita GDP. Itni chhotti si baat nahi samajh aa rahi tumhe? Vishwaguru banna zaruri hai."
221,Tumari fielding set ho chuki hai
222,Chernobyl ka AQI 21.6 hai 🙃
223,According to so called true hindu abhi kya ss dikha rahe ho christmas aur new year prr dikhana
224,Maine sarcasm me bola hai bhai
225,Uske liye end mein /s laga
226,Are sorry my bad bhul gaya
227,Okay ji dekh lenge but iss me so called Hindu kahan se aya ?
228,"Hai na pura reddit bhara padha hai
They are so proud in bursting crackers saying 1 din me kuch nahi hota"
229,"1 din me sahi me kuch nahi hoga par ye log 1 hafte pehle shuru hojate hai fir 1 hafte bad band karte hai , aur jisme sabse zyada dhua hoga inko wahi pasand ata hai , celebration ke liye fuljadi , anaar kafi hote hai"
230,Audacity dekhna abhi log isko bhi aate honge defend karne
231,"bhai maine to ye bhi logo ko kehte hue dekha hai ""Shastro me likha hai patakhe jalane chahiye diwali me"""
232,Patakha unbanned karne walon ki maa ki ch*t teen baar
233,"Sabse maje ki baat je hai ki Dilli wale isko leke ab question bhi nhi pooch sakte.

Sarkar badal gyi...court order bhi badal gya.

Ab khanste khanste jao naukri krne aur tax bharo netao aur babuo ke aish-o araam k liye."
234,"you become the thing you hate. 

ab har ghar se kejriwal niklega 

https://preview.redd.it/rivtl9zbpewf1.jpeg?width=487&amp;format=pjpg&amp;auto=webp&amp;s=5122d32d34751c92a081ff8d33b1bffaaf7957cc"
235,1975💀💀💀 bhai yaha ke log jinda hai na? 
236,"Koi baat ni, jo log bache hai wo agle Diwali khatam ho jayenge 💀💀"
237,population control karne ka tareeka cazual hai
238,Tum ab sas kese longe 💀
239,Hindu khatre main the. Ab diwali k baad thoda khatra kam ho gaya.
240,Bande hi marr gaye pollution se toh khatra khatam!
241,Log b$diwal£ sudhrenge nhi
242,Patake fodne walo ki mkc
