,Hinglish_Comments
900,Har jagah maut hi h bhai
901,"Yeh sab kuch nahi hota, shuba jaldi utho sab thik ho jaega"
902,Aur khao bahar ka ganda khana
903,Faridabad mei to Kam hai bhai
904,Apna lungs check karwao ek baar pata chal jayega kitna kya hua hai
905,Aaj aapka Heppi Baday hai? Tab aaj toh zaroor cake katega.
906,"Aapko khana hai?

https://preview.redd.it/1h3lnywcok7e1.jpeg?width=364&amp;format=pjpg&amp;auto=webp&amp;s=e81531bf85746db8aea3dbc3a334ff8ae2ed8b83"
907,"Ji, bhej dijiye."
908,"Address batao bhej deta hu

https://preview.redd.it/47x9g4m0pk7e1.jpeg?width=334&amp;format=pjpg&amp;auto=webp&amp;s=2528d7757f766dd26aabf667dc36e0482cfddbb0"
909,Shipping Cost cake se zyaada pad jayega :')
910,"Koi na aap ye khao

https://preview.redd.it/s0zyjd7s1l7e1.jpeg?width=3000&amp;format=pjpg&amp;auto=webp&amp;s=b4ee23d401d703f809ba5dd6fce0b027cbd76c2a"
911,"Mask hta zra Delhi me rah 
Chand mahino me na mar jae to mujhse ake kah"
912,Main to jab sey paida hua delhi main reh Raha huu aur woh bhi bina mask abhi tak nahi mara.
913,"Bhai tu serious kayko ho gya yrr pollution ke liye bola 
Itna kya serious hona abhi to tum bhi jante kis condition me hai delhi"
914,Yeh Condition to har metro city ki hai. Kahi  jaoo aisa hee paogey bro.
915,"Aur uske baad kya karoge?

https://preview.redd.it/ql7bpz1k7j7e1.jpeg?width=333&amp;format=pjpg&amp;auto=webp&amp;s=da33fc67b46e96fd241eeeb8b14caffc7dac04f6"
916,Kerela jaya karunga bhai summers hote hi... Beaches pe maje lunga fir.
917,"Achaa ji. Fir uske baad?

https://preview.redd.it/wkvmcwtz8j7e1.jpeg?width=700&amp;format=pjpg&amp;auto=webp&amp;s=36fd63c2d4672272de68e77dc6345fe7435520c2"
918,"Suniye na

Jaate jaate meri ek baat ka jawaab dete jaiye

Umm huhh

***Konse kalal ki chaddi pehne hain?***

https://preview.redd.it/swf1wy6s9j7e1.jpeg?width=260&amp;format=pjpg&amp;auto=webp&amp;s=98144f704f460e258da8a55513140834fb17145a"
919,Cringe hai bhai tu!!
920,"Jaisa bhi hu khush hu

https://preview.redd.it/m5iefi9hgj7e1.jpeg?width=313&amp;format=pjpg&amp;auto=webp&amp;s=73bd543b5451a3f3a90cf80c2054c85784a4d521"
921,Kaunsa hyd ka aqi bhut acha hai? Night life 0 hai upar se veg logo ke liye bhut dikkt h udhr.
922,Sab hai
923,Lived there for 2 yrs. Kuch ni h
924,"Mammy me gao ake gobar pani kr lungi.
Delhi me rah kar lungs kharab nahi karungi"
925,"Ohooo John McKenzie from Bilaspur, aap idhar

https://preview.redd.it/amhj1bou8j7e1.jpeg?width=313&amp;format=pjpg&amp;auto=webp&amp;s=0d0cdfa745bb9cce0231d0dfb9a368bbe5c9a26b"
926,Bilaspur sunte hi Vicky ki mummy yaad ajati
927,Beta Rona naiiiii B-key betaaaaa
928,"B-Key ko kry aa rha hai

https://preview.redd.it/4nqf3r8kbj7e1.jpeg?width=329&amp;format=pjpg&amp;auto=webp&amp;s=f100c3965f7f61e3104745b71b5fd121d860fbd4"
929,itne sare gobar ka kya karogi ? Gobar hai Sona nhi hai
930,"Par aap log to mahilaon ko paise de rahe ho monthly 1k schemes ke jariye! Acchi hawa, paani kaha chahiye dilli walo ko?"
931,Sabko chaiyeee aur mai kud victim hun poor air quality ka
932,Gadi main purifier office mai purifier ghar main purifier ni hota hoga bhai.. upar se paise ka nasha
933,Paise nahi hai
934,Mask le le fir
935,Ye saari iss phone ki glti h
936,Yaar this is real mudda. Is par baat nahi hogi. Sorry 😐
937,15 saal say ab new norm 5 saal diesel aur petrol vehicle 🤪🤪🤪
938,ye diwali na bhai kitna pollution ho gaya dekho kitne phatake phodte hai log.. /s
939,jab kam hua tha toh maintain ni kra ab ro rahe bande
940,Ye hi wo ishaara hai jo samajhdaar ko diya jaata hai.
941,AQI gaya maa chudane. Aisi koi cheez hi nhi hoti.
942,Paadne se ho raha ye sab. Aisa mera manna hai
943,Planting plants alongside roads will help. Also the stubble burning situation is the main reason for the pollution but due to appeasement politics the government wouldn't do that.
944,Bakwas means nonsense
945,"Abhi wo AQI monitor ke paas paani chhidak Rahe hain. News mein aaya hai but if they're doing this, we're in trouble"
946,"Arrreyyy, have you seen that video jaha monitoring station ke saamne paani chidak rahe hai taaki readings kam ho jayeein????"
947,"Bro jab 250 AQI = 1 BAQWAS hua
Toh us hisab se 1000 AQI = 4 BAQWAS hoga na 😭😭😭"
948,tum ye baqwas ki baatein band karo
949,Kya BAQWAS hai ye 😂😂
950,Kya BAQWAS hai 😭
951,Aur dho mogli kho vote
952,"The problem is we do not raise voice against the system. The middle class which is a large portion of India is just too busy in making ends meet. Survival main hi log busy hai, protest kaha hoga against the big and the mighty looting India."
953,Nahi mujhe batao kya fookh k baatein banate hai ye log?
954,Kahan se khareedi aisi BAQWAS dictionary?
955,Kya BAQWAS h
956,Asthama ho jayega
957,"Bruh is this legit? 

Kya pukha hai be?"
958,Ye kya BAQWAS hai
959,"Am I the only one to read it as ""BAKWAS?"""
960,"Initially I thought ye ho gaya, agar acronym बकवास nahi to to main trust kar leta"
961,"BAQWAS ❎❎❎❎
BAKWAS ✅✅✅✅"
962,"Haan Bhai, it's scientifically proven by nasa that bad air quality cannot affect indian lungs. They are built better. Nasa which codes in sanskrit is already researching how Indian genetics can be used to combat air pollution. Koti koti pranaam."
963,Kon sa maal phooka tha usne ye tweet likhne se pahle
964,"Toh kaise kare demand? They don't even show up in our locality, ab humesha protest karne ka time toh hai nahi sbke paas. Twitter social media se kuchh farak padta nahi inko."
965,"Ye toh saale protest bhi nhi krne dete, uske liye bhi inse permission lo"
966,Bhaisahab. Humne to Kejru ko bhi bahut umeed se vote diya tha. Kya hi kiya usne bhi?
967,But improvement aayi thi kahi during his tenure?
968,This is only the first time ki I am having difficulty in breathing. Never happened before. Also the govt unbanned crackers for vote bank - never happened before nor do I think it should be continued
969,delhi walo ka to khel khatam hai lmao
970,Lagta hai naya population control measure hai government ka. Aur superhumans production unit bhi lag gyi hai humari capital mein. /s
971,"I've been keeping a log of the AQI and PM2.5 in Noida for work. How accurate are these websites?

Def not gonna use the government one, but I'm still curious about aqi.in"
972,"Still people won't protest.

Delhi people now enjoying Madhya Pradesh style governance where politicians tell reporters to ""move on"" after children die from syrup.

Atleast AAP was empathic and did Press Conference regularly during these times. Now no one gives a sh*t about Delhi people.

In the entire India, among politicians, only AAP genuinely cared about Delhi people. Delhi people can now cry all they want - no one's hearing or coming. The ones who stood for them and saw eye to eye with Central Government have been defeated by them.

All other parties view Delhi people as not worth caring for."
973,"786 ho gya bhai, Hindu khatre mae hai"
974,Kya Matlab Rekha ji ke karyakaal me Allah ka number? 🤡
975,"Sabko callout krdo, but the main reason of this is burning of agricultural stubble in both punjab and haryana"
976,You sound like someone who’s been bursting crackers. Government ko call out to kiya - they have to make them stop too
977,"Mere yaha par bhi &lt;50

Can't imagine living in 800
😷"
978,Geography ki kharab hai delhi ki. Kuch nahi ho sakta
979,That was 2010. Kai ko inta yaad karta hai Ganjadi gandhi ko?
980,"That's a good analogy. My analogy was based on my experience.
In India, I hear ""Baap Baap hota hai, baap ko mat sikhao""

In the West, I hear ""My grandson can fix your computer. He knows more than me""

""India resists change"""
981,Hello Bhai. Any link ? I need to develop one for my home.
982,Meri wishlist mein pollution se marna nhi likha tha 😒
983,Puri Delhi move out ho rhi hai in Indraprasth so Delhi is just a hypothetical state
984,"Ye toh cheap tactics hai. Name change mai crores lagte hai, Allahabad to Prayagraj change mai around 300crore spend hue the. Imagine that being spend to tackle pollution."
985,"Delhi ka naamkaran karke Bahamas karna zaroori hai


Isse air, water, land and noise pollution sab khatam ho jayega


Modi ji se request hai 🙏🏻"
986,Aise kaise? Koi reason hai kya??
987,"Delhi ka naam Bahamas karne se Hawa, paani saaf ho jayenge turant.

It's like purane kapde utaar ke naye pehen liye, it's that easy.

Saara problem hi naam ki wjh se hai, pollution toh abhi hat jayega meter ke paas paani spray karte raho."
988,Acha
989,Abey anpad congressi ispe bhi politics shuru kardi tere kejriwal ki den hai
990,Fielding set hai
991,Seriously is saal pta nhi kyu nhi lga rhe
992,Abhi grap 4 lag jaega toh 10-15 din baad kya dikhayenge ye log action ke naam par?
993,Abey nakli bas itna abb tho addat ho jani chaiye shimla manali mat chala jaiyo warna suffocate hoke maar jayega now we are like saltwater fish freahwater me maut
994,I think so I'm planning to go on Venus it's pretty much suitable for us people I can't breathe in clean air anymore mera dam ghut jyega
995,Abhi kuch din ruko co2 ne se o2 nikalne ka bhi feature ayyega delhi walo me
996,Maut nischit hai☠️
997,Nishchit tho nahi 10 9 saal kam ho jayenge life se
998,Smog me dawai bhi nhi dikhrai🙃
999,Chuhe marne k dawai khaani thi galti se cough syrup pi liya 🙂
1000,At this point smoking is literally beneficial atleast uski smoke filter hokar aa rhi hai 😂
1001,Bahot bura lag raha hai helpless feel karke.
1002,Marr jayenge thode din mein helpless feel karke
1003,Baat toh sahi hai.
1004,Yaar 400 par toh chalo phir bhi dekh liya tha 800 par how bhai it's not acceptable 😐
1005,Hope she is okay now take care of yourself and your loved one's kyuki ab kuch nhi rkha hai iss gorment mein 🥲
1006,2 baari paar kar dia it's too much I'll be dead agar iss se jyada ho gya toh
1007,"If you can avoid it please do 
Delhi is really suffering it isn't funny anymore 
Ab toh humare meme bhi roo rhe hai 🙂"
1008,"i know yar it not funny
and im not making fun
people are really suffering there. 
and i hope everything will be fine soon.
govt se to koi ummeed ni h.
ab bgwaan hi kuch kr skte h"
1009,Itna jyada kaise kullu me ?? 68 bhi jyada hai 50 se kam to hona hi chahiye
1010,😭😭sala ek to mere khasi nahi ruk rahi...teen din se ghar se bahar kadam nahi rakha hai tab ye haal hai...it's such a series and dangerous situation idk wtf gov is doing?? Itna ganda haal to last year bhi nahi hua tha..on the other hand these citizens are roaming in the city without any mask 🤦🏻sab dumb hai bhai we are literally living in a gas chamber
1011,🫩ye in logo ko tab akal ayegi jab inke fefde sath dena band kar denge
1012,"Hope you will get well this isn't about BJP anymore this is a system failure 
Dono jagha ki state government hi blunder kar rhi hai fuck them both"
1013,Loda mera tum jante bhi kuchh rss ke bare me ? Ek ad ne kuchh bol diya hoga to tum usse sab ko generalize karoge ?
1014,Omg 😂 sharam nhi ati pr bjp ko itni roasting k baad bhi
1015,"12 saal hogaye hai.
Sharam kahan aayegi."
1016,Ab to logo ko bhi adat ho gyi lutne ki inse
1017,"Exactly! My friend. Here u can witness a live example of how ""they"" use liberals aka left winger's pov as ""pivots"" to blatantly target h""indu community.
Actually I'm not sure, but quite confident that it's one of ""them"" who made that X post purposefully using ""smoke is part of our ancient rituals"", subtly targeting h""indus while the main target being bjp. 
I urge u to be more cunning henceforth."
1018,Tere jaise bhi kick hoge tere bhai bhenon k saath buddy don't u worry
1019,r/indianmemer mai post karoge to ek certain groups seriously lenge
1020,Isse aq badal jayegi kya?
1021,"Ye kya Baqwas kar rhe ho bencho

![gif](giphy|Ug0lsEiLeLopFxBGVh)"
1022,Patakhe fodne ke baad hum log gyaan kyu pel rhe hai? Ise randirona nhi kehte? English me hypocrisy?
1023,ab e20 pe rona mat
1024,Litre Kilogram gram metre wagera bhi hata do na agar aisa hai toh😂😂😂
1025,aajkal BAQWAS badhti ja rhi hai 
1026,Aur do bjp ko vote
1027,Sirf deepawali ke din aajate hei pollution ke bare mei baat karne vale🤡
1028,Zor Zor se bolke Logo ko scheme bata de..
1029,Diwali gye din hogye lkin in ka RR khtm ni hora saare bahar se job krne aaye dalalo ka.😪
1030,"Real ID se aao Bhavish Aggarwal, Mr wEsTerN cUltUre"
1031,"If idiocy had a tweet.

Trying to be sarcastic and environmentalist on one day of the year whereas ignoring every other cause of pollution for the rest of the year.

I mean anyone who has a logical brain see the hypocrisy in this but cool bhi to ban na h, we have to show we care about the environment without actually doing any major contribution and criticising Diwali and everything in India is the easiest method to do so.

 

People behave like AQI is getting from 50 to 500 during Diwali"
1032,Tu ek kam kar India se bhar nikal ja waha kush rahega..... yaha to yahi  rona pitana rahega.....
1033,"Good to have in general bc they filter out viruses, allergens, and dust in addition to smoke"
1034,"Bhai, you cannot just blame pollution on this one thing. Indians are very good at putting blame. Every country on earth is getting bombed, who is talking about pollution there? 
In US on 4th of July an equal amount of crackers burst but no one talks about pollution from crackers there. Yeh bas india mei hi hone lagta hai. It's not just crackers there are a thousand other things which are polluting our country and sorry to say one of them is your mentality."
1035,Sah lege utna pollution 5 din to hai
1036,"Make the infrastructure first. Then comes the question of using it properly. Aap chronology samajhiye. 

Don’t need to learn how to traverse through pothole ridden city or non-existent footpaths."
1037,Tum sense banao aur yahan downvotes Milenge.
1038,"Sir ko boliye spelling mistake hai, worst*--class"
1039,Sir bolne ke laayki ka nahi hai woh
1040,Aur $5T nahi $5K hoga
1041,Wo $5 trillion me se $1 Trillion ye apne jeb me leke jaega ethanol blending karke
1042,"Esko logo bohot sir pe chadhaya hai.
Isliye currently yeh eklauta BJP wala hai jo bakchodi kar raha hai"
1043,JVLR aao kabhi.
1044,"Chutiye log! Pehle rasta theek se banao.. opps woh to nahi hai🤬😡

Sab neta logo ko cycle ke beech wale dande pe bitha ke Mumbai darshan karvao... Jab gote jaam honge tabhi apne yaha kaam honge."
1045,Ye aadmi bohot hi tutiya banata h
1046,itne bekaar roads sometimes I wonder itna tax q le rahe bc
1047,Ye buddha Sugarcane se petrol banayega apne hi factories se
1048,Bhai take Gadkari's cock out of your mouth
1049,Bro Melbourne ka rasta humein bhi batao.
1050,Bhai gadkari ji ne idhar tak rasta nahi banaya 😜
1051,NiGa hai toh mushkil hai
1052,Bsdk konsa nasha karte hai pata nahi
1053,"Rx

Tab.  Copium 650MG.....................1-----1-----1

20 yrs"
1054,they make fun of you if you care about these things. call you slurs. Lol. Education ka koi point nahi hai for some people
1055,Aree bhai vertical boob
1056,"Main issues - Overpopulation, illiteracy, lack of civic sense, ""I dont care"" attitude, politicians selfishness and apathy, corruption, unwilligness to improve. No wonder, every other person in India wants to go out of the country as they are fed up with this."
1057,"Aree theek h bro, banda frustrated h, let it slide."
1058,Areh bhai scale alga nothing else it is like saying some site is showing 12(inches) while another is showing 1 (feet)
1059,I am chill  bhai. But do you agree now that the data in the post is not correct or you still believe that it is correct?
1060,And you know this is incorrect data. Bhai no one is saying you are against diwali. Due to fire crackers definitely aqi suffers. But posts like this are on which clearly the data is inaccurate are used against people who love celebration this day that comes just once a year. I have no grudge against you man or anyone even who is against diwali I am just against the incorrect data.
1061,I am not going to drag this conversation any further. Not this diwali but this can be used before the next one. I am not saying you have edited the ss but you see that aqi value is not right even if it's on the site and is definitely worth cross checking. I am taking it lightly I hope you are too. No hard feelings bhai. Happy Diwali 🪔
1062,"Chill, bhai. In a week, everything will go back to normal. No one posted anything about AQI during any other festival or celebration, so why are you so concerned about the same during Diwali? It’s not like people are celebrating a hundred times a year, it’s a festival, and bursting crackers is a part of it.

If you’re really that concerned, plant ten trees and take care of them and do that EVERY Diwali instead of posting rants online. Have you stopped using vehicles or anything else that affects AQI? No, right? Then start helping by planting trees instead of posting here."
1063,You should be concerned too.. jab bahar niklo mask lagaalo.. this falls in the hazardous category... He is doing a fine job spreading awareness.. diwali mana liye ab sehat ka dhyan rakho.. ek week bahut hota h.. thoda precautions lo.. my friend is working in cement plant and wears N95 all the time and the AQI over there isn't half of what it is now.. so take care everyone.
1064,"Zyada din jeekar bhi kya krlega tu bhai?? Enjoy the moment you're present rn , diwali saal mein ek baar ata hai and usi din hi patakhe nhi fodenge toh kab fodenge?"
1065,Are you a bit retarded . Cigarette hookah ek admi leta he pura city ya street ko nahi deta he
1066,"Tereko jeena nai hoga, mereko aur mere family ko jeena hai and we fight for our rights. You stay in your low standard life, we choose to stay healthy and have a good status. Wish you good luck with that mentality.
I am sure, you must be one if those who throw plastics here and there and think “kya ho jayega ek bottle se”."
1067,"Lmaoo!! You think I'm the low life because I said something like this , the whole nation is like this bruh you can't change the fact you want to stay healthy the govt won't let you the food you're eating it's way more toxic than air now good luck with that...and FYI I don't even spit on the ground and plastic fekna toh dur ki baat hai ."
1068,If mera concern ye hota toh diwali se phele post krta
1069,"The nonchalant way you dismiss this severe topic by saying ""ek week mein thik ho jayega"", there will be a time when we won't have a week."
1070,Dusre dharm meh behn log seh shaadi karte hai. Hum bhi start karde kya?? Logic hai tere baat meh
1071,Bhai bekar re eh sabu post karani samastanku jana achi AQI badhiki achi !
1072,"805 he bro pura pic dekho
And AqI aise kaam nahi krta 1000 mein nahi marte he"
1073,"Bro this is literally how AQI works. They give masks to wear in coal fields becuase it shoots above 500 AQI there and breathing there even for half a day will cause you serious injuries.

Also pura map dekh bhai, bapuji nagar ke niche to almost 2000 paar kardiya hai. I don't think you can even breathe 10 min in that. Most probably their measurement instrument went bad past a point."
1074,"Yeah maybe 
Mera company thodina 
Now it is showing 203"
1075,"If you're from Delhi city, Mumbai can't compare to the kind of infrastructure you have, get and will always have there. Those are not the reasons people who have always called this home - live here.

Mumbai pays one third of all of India's personal and corporate income tax and accounts for one fifth of the entire country's excise - a total of 40%. That's how many people live and make an honest living here - one that contributes to running the country, not just have multiple plush houses with income that contributes nothing for nation building (no matter how unhappily and reluctantly).

Delhi in comparison pays a little more that 1/8th - 13% of all taxes. However, when it comes to budget allocation back from the center or even the Maharashtra government, Mumbai's share doesn't even remotely match its contribution. This city is simply expected to slog on despite not getting its fair share of support - because the others ""need"" it more.

Add to that - geographically, Delhi is landlocked - can grow evenly in most directions - that keeps the real estate (therefore rental) demand and hence prices under control. Mumbai is a coastal city and can only grow in two directions along the coast (premium) or away from it (non premium). The premium of living closer to the sea keeps moving up because everyone wishes to live there - high demand that only keeps rising. Everyone from across MMR region also want to spend time and money, hangout and chill by the sea. So it also has the concentration of the better retail, entertainment and dining investments. 

Thane for example on the other hand has much better amenities than Bandra or Versova at a much cheaper rate. Roads are relatively better there (now) - so is all of Navi Mumbai right until Panvel. But if you had to live there, it definitely wouldn't feel like the ""Mumbai experience"". 

If you are going to compare the relative cost of living in Mumbai vs what it has to offer by way of infrastructure, quality of living and amenities to Delhi - Delhi would win hands down. We use what we have to sustain living here - continue to pay everyone else's share of taxes. But we can't ever expect that our living experience would be even equal to the country's capital - because that's the face of the country. 

Meanwhile, you're right about that other than Mumbai and Delhi (and to some extent the measly 4 other metros) are where all the best jobs are...and dwindling in favor of gig workers. 

BUT - I know I'd never live in Delhi despite it being a lot more luxurious in comparison at much lower spends - simply because I can't stand the general population's attitude, civic sense and generally poor level of safety because of the general level of day to day violence and aggression there. Large parts of the populations who call that home are a physical/mental/emotional threat to not just women (which they are), but also to men. 

Day to day living in Mumbai is far more peaceful, in comparison. Not saying Mumbai doesn't have its fair share of violence, aggression and threats to safety. But that's not built into its DNA as Delhi's is. The tujhe-pata-hai-mera-baap-kaun-hai attitude is non existent here. We all know who our parents are. The average Mumbai local person doesn't go around asking random strangers if they know that - unlike the average Delhi person. But I guess, if that's what you are used to, it wouldn't bother you much. But the lack of amenities, infrastructure and space in Mumbai would bother you a lot more than it bothers us. We are used to this - and navigate our lives around it. 

You need to choose what you want and why - simply that. And then make your peace with whatever you choose."
1076,Kyaa baat hai. Well written indeed!
1077,"Bhai delhi se hai toh bacchan mt de aur hatespeech mt de social platforms pr, nahi rehna toh chale ja delhi se bohot accha hai bombay"
1078,Nahi hun bhai delhi se 
1079,Phir jaha se ho bhi ho waha chal do
1080,"Companies ko bolo yahan office band kar de, khushi khushi chale jaunga "
1081,Bruh ye attitude rkh ke yaha survive nahi kr payega
1082,"&gt;so it's liveable for natives like us

It's not even liveable for you guys. It's liveable for you because migrants clean up after you. They build this city everyday.

Kooye ke mendhak 🐸 aur vaisi hi mentality."
1083,"It isn't liveable because it's oversaturated. There's easy 10x the people than the capacity. Local trains are an example.

They clean up because they make the filth. Who do you think lives in slums? 

&gt;They build this city everyday.

Gee, If they do ot EVERYDAY, I wonder why can't they build one in their shithole just ONCE in their Lifetime. They must be building it everyday right, must be some fairy to make it disappear every night.

&gt;Kooye ke mendhak 🐸 aur vaisi hi mentality.

Not sure what language is this. Definitely not the native one.

Edit: apparently the cattle has also begun to learn English. Finally. Just hope they also have the brains to not push their slum language on the natives. 

Here they come with the downvotes. As if imaginary points matter."
1084,"Arre arre ""muh band rakho"" wala crowd aa gaya!"
1085,"Mumbai is always going to be home for me. I’ve lived there 28 years of my life – no city can replace it. Haan, I know the rent is crazy and brokerage is high, but think about it… people from all over come to Mumbai to find work, just like you did. When there are so many people moving in, obviously the demand is high and the city feels crowded. That’s just how it is. Every city has its own problems, but for me, Mumbai’s energy and spirit make it worth it. For me, Mumbai will always be my city. Instead of complaining, I feel like we should just learn to love it."
1086,😂😂 And here they come sprit of Mumbai ke....😂😂
1087,tu fir aagya nirlaj jitne pise kamaye usme se thore kharch kar
1088,Kis pa kharch karana ka liye khara hai Bhai?
1089,Sabse bhikari log tum ho jab Sarkar rule Lati hai private company ko business me lane ke liye toh tum rr karte ho aur jab Mandi Accha dam deta nhi fir bhi rr jara koi Naukri karo andolanjeevi
1090,"Bhai ek toh Teri bhaat ka koi point meri post se ya mere reply se match nahi ho raha 

Or dosra agar har koi naukri kara ga tho tu Pisa da kar bhi anaj kaha sa laye ga

Bhai bhikari kasa bol sakta ha tu huma hum kud mahnat kar ka khata har or kud ki ugai gai fasal kar rate bhi government ko fix karna deta hai 

And private company agar power main ati to usaka fida mere jasa bada kisan to utha la ga par jin kisano ki sabsa badi abadi hai(chhota kisan jinaka kaam 4 se 7 killo par chalta ha)vo maar jata kyoki .... bahut jada explain karna pada ga abi maan nahi or sayad fida bi nahi"
